{
  "thermal_result_id": "thermres_60a7f1b8c9d4e5f6a7b8c9d4",
  "analysis_job_id": "job_60a7f1b8c9d4e5f6a7b8c9d2",
  "dataset_id": "dataset_60a7f1b8c9d4e5f6a7b8c9d0",
  "field_id": "field_507f1f77bcf86cd799439011",
  "mission_id": "mission_60a7f1b8c9d4e5f6a7b8c9d0",
  "sensor_type": "FLIR_BOSON_320",
  "canopy_temperature": {
    "layer_uri": "s3://tarlaanaliz-results/2026/06/thermal/canopy_temp_f47ac10b.tif",
    "min_celsius": 22.5,
    "max_celsius": 41.3,
    "mean_celsius": 31.8
  },
  "cwsi": {
    "layer_uri": "s3://tarlaanaliz-results/2026/06/thermal/cwsi_f47ac10b.tif",
    "min_cwsi": 0.12,
    "max_cwsi": 0.78,
    "mean_cwsi": 0.43
  },
  "canopy_soil_delta": {
    "layer_uri": "s3://tarlaanaliz-results/2026/06/thermal/delta_f47ac10b.tif",
    "min_celsius": -2.1,
    "max_celsius": 8.7,
    "mean_celsius": 3.4
  },
  "irrigation_efficiency": {
    "layer_uri": "s3://tarlaanaliz-results/2026/06/thermal/irrigation_eff_f47ac10b.tif",
    "mean_efficiency": 0.62
  },
  "original_resolution": {
    "width_px": 320,
    "height_px": 256
  },
  "upsampled_resolution": {
    "width_px": 2048,
    "height_px": 1536,
    "method": "BILINEAR"
  },
  "thermal_qc": {
    "status": "PASS",
    "temperature_range_valid": true,
    "sensor_drift_detected": false,
    "notes": null
  },
  "layer_code": "THERMAL_STRESS",
  "created_at": "2026-06-15T14:30:00Z"
}
